<?xml version="1.0" encoding="UTF-8" ?>
<Verification xml:lang="en" xmlns:xml="http://www.w3.org/XML/1998/namespace" xmlns:xsi="http://www.w3.org/2001/XMLSchema-instance" xsi:noNamespaceSchemaLocation="http://dd.eionet.europa.eu/schemas/fgases-2025/Verification.xsd">
    <GeneralReportData status="incomplete">
        <Company status="incomplete">
            <CompanyId></CompanyId>
            <CompanyName></CompanyName>
            <PostalAddress>
                <StreetAddress></StreetAddress>
                <City></City>
                <Region></Region>
                <PostalCode></PostalCode>
            </PostalAddress>
            <Country desc="">
                <Name></Name>
                <Type></Type>
            </Country>
            
            <ContactInfo>
                <Telephone></Telephone>
                <FaxNumber></FaxNumber>
                <Email></Email>
                <ContactPerson></ContactPerson>
            </ContactInfo>
            <EoriCode></EoriCode>
            <VatCode></VatCode>
            <NoReporting></NoReporting>
        </Company>
        <EuLegalRepresentativeCompany>           
            <Name></Name>
            <Country>
                <Type></Type>
                <Name></Name>
            </Country>            
        </EuLegalRepresentativeCompany>
        <Auditor>
            <Auditor_uid></Auditor_uid>
            <Name></Name>
            <LeadAuditorEmail></LeadAuditorEmail>
            <Telephone></Telephone>
            <Website></Website>
            <Company>
                <CompanyName></CompanyName>
                <City></City>
            </Company>
            <Adress>
                <Number></Number>
                <Street></Street>
                <PostalCode></PostalCode>
            </Adress>
            <Country>
                <Type></Type>
                <Name></Name>
            </Country>
        </Auditor>
    </GeneralReportData>
    <VerificationScope>
        <DataReportUrl></DataReportUrl>
        <SubmissionDate></SubmissionDate>
        <TransactionYear></TransactionYear>
        <Bulk></Bulk>
        <Equipment></Equipment>
    </VerificationScope>
     <BulkHFCs>
         <section_I_1>
             <confirmation_a>
                 <checked></checked>
             </confirmation_a>
             <confirmation_b>
                 <checked></checked>
                 <option_1></option_1>
                 <option_2></option_2>
                 <option_3></option_3>
                 <option_4></option_4>
                 <option_4_reason></option_4_reason>
             </confirmation_b>
             <confirmation_c>
                 <checked></checked>
                 <option_1></option_1>
                 <option_2></option_2>
                 <option_3></option_3>
                 <option_4></option_4>
                 <option_4_reason></option_4_reason>
             </confirmation_c>
         </section_I_1>
         <section_I_2>
             <tr_01A>
                 <confirmation_a>
                     <checked></checked>
                 </confirmation_a>
                 <confirmation_b>
                     <checked></checked>
                     <option_1></option_1>
                     <option_2></option_2>
                     <option_3></option_3>
                     <option_4></option_4>
                     <option_4_reason></option_4_reason>
                 </confirmation_b>
                 <confirmation_c>
                     <checked></checked>
                     <option_1></option_1>
                     <option_2></option_2>
                     <option_3></option_3>
                     <option_4></option_4>
                     <option_4_reason></option_4_reason>
                 </confirmation_c>
             </tr_01A>
             <tr_01A_a_own>
                 <confirmation_a>
                     <checked></checked>
                 </confirmation_a>
                 <confirmation_b>
                     <checked></checked>
                     <option_1></option_1>
                     <option_2></option_2>
                     <option_3></option_3>
                     <option_4></option_4>
                     <option_4_reason></option_4_reason>
                 </confirmation_b>
                 <confirmation_c>
                     <checked></checked>
                     <option_1></option_1>
                     <option_2></option_2>
                     <option_3></option_3>
                     <option_4></option_4>
                     <option_4_reason></option_4_reason>
                 </confirmation_c>
             </tr_01A_a_own>
             <tr_01A_a_other>
                 <confirmation_a>
                     <checked></checked>
                 </confirmation_a>
                 <confirmation_b>
                     <checked></checked>
                     <option_1></option_1>
                     <option_2></option_2>
                     <option_3></option_3>
                     <option_4></option_4>
                     <option_4_reason></option_4_reason>
                 </confirmation_b>
                 <confirmation_c>
                     <checked></checked>
                     <option_1></option_1>
                     <option_2></option_2>
                     <option_3></option_3>
                     <option_4></option_4>
                     <option_4_reason></option_4_reason>
                 </confirmation_c>
             </tr_01A_a_other>
             <tr_01B>
                 <confirmation_a>
                     <checked></checked>
                 </confirmation_a>
                 <confirmation_b>
                     <checked></checked>
                     <option_1></option_1>
                     <option_2></option_2>
                     <option_3></option_3>
                     <option_4></option_4>
                     <option_4_reason></option_4_reason>
                 </confirmation_b>
                 <confirmation_c>
                     <checked></checked>
                     <option_1></option_1>
                     <option_2></option_2>
                     <option_3></option_3>
                     <option_4></option_4>
                     <option_4_reason></option_4_reason>
                 </confirmation_c>
             </tr_01B>
             <tr_01C>
                 <confirmation_a>
                     <checked></checked>
                 </confirmation_a>
                 <confirmation_b>
                     <checked></checked>
                     <option_1></option_1>
                     <option_2></option_2>
                     <option_3></option_3>
                     <option_4></option_4>
                     <option_4_reason></option_4_reason>
                 </confirmation_b>
                 <confirmation_c>
                     <checked></checked>
                     <option_1></option_1>
                     <option_2></option_2>
                     <option_3></option_3>
                     <option_4></option_4>
                     <option_4_reason></option_4_reason>
                 </confirmation_c>
             </tr_01C>
             <tr_02A>
                 <confirmation_a>
                     <checked></checked>
                 </confirmation_a>
                 <confirmation_b>
                     <checked></checked>
                     <option_1></option_1>
                     <option_2></option_2>
                     <option_3></option_3>
                     <option_4></option_4>
                     <option_4_reason></option_4_reason>
                 </confirmation_b>
                 <confirmation_c>
                     <checked></checked>
                     <option_1></option_1>
                     <option_2></option_2>
                     <option_3></option_3>
                     <option_4></option_4>
                     <option_4_reason></option_4_reason>
                 </confirmation_c>
             </tr_02A>
             <tr_02B>
                 <confirmation_a>
                     <checked></checked>
                 </confirmation_a>
                 <confirmation_b>
                     <checked></checked>
                     <option_1></option_1>
                     <option_2></option_2>
                     <option_3></option_3>
                     <option_4></option_4>
                     <option_4_reason></option_4_reason>
                 </confirmation_b>
                 <confirmation_c>
                     <checked></checked>
                     <option_1></option_1>
                     <option_2></option_2>
                     <option_3></option_3>
                     <option_4></option_4>
                     <option_4_reason></option_4_reason>
                 </confirmation_c>
             </tr_02B>
             <tr_02G>
                 <confirmation_a>
                     <checked></checked>
                 </confirmation_a>
                 <confirmation_b>
                     <checked></checked>
                     <option_1></option_1>
                     <option_2></option_2>
                     <option_3></option_3>
                     <option_4></option_4>
                     <option_4_reason></option_4_reason>
                 </confirmation_b>
                 <confirmation_c>
                     <checked></checked>
                     <option_1></option_1>
                     <option_2></option_2>
                     <option_3></option_3>
                     <option_4></option_4>
                     <option_4_reason></option_4_reason>
                 </confirmation_c>
             </tr_02G>
             <tr_02H>
                 <confirmation_a>
                     <checked></checked>
                 </confirmation_a>
                 <confirmation_b>
                     <checked></checked>
                     <option_1></option_1>
                     <option_2></option_2>